{
  "$schema": "https://json-schema.org/draft/2020-12/schema",
  "$id": "https://endtoendeverywhere.org/e2eesa/schemas/server-deployment-evidence.schema.json",
  "title": "E2EESA server-deployment-evidence",
  "type": "object",
  "additionalProperties": false,
  "required": [
    "schema_version",
    "policy_id",
    "profile_ref",
    "product_id",
    "product_version",
    "platform",
    "policy_digest",
    "assessor_id",
    "observed_at",
    "report_refs",
    "deployment_id",
    "assessed_component_ids",
    "components",
    "objects",
    "client_envelope_validation",
    "storage_credentials_separate_from_e2ee",
    "compromise_test_completed"
  ],
  "properties": {
    "schema_version": {
      "type": "string",
      "const": "0.1"
    },
    "policy_id": {
      "type": "string",
      "pattern": "^[a-z0-9]+(?:-[a-z0-9]+)*$"
    },
    "profile_ref": {
      "type": "string",
      "minLength": 1
    },
    "product_id": {
      "type": "string",
      "pattern": "^[a-z0-9]+(?:-[a-z0-9]+)*$"
    },
    "product_version": {
      "type": "string",
      "minLength": 1
    },
    "platform": {
      "type": "string",
      "minLength": 1
    },
    "policy_digest": {
      "type": "string",
      "pattern": "^sha256:[0-9a-f]{64}$"
    },
    "assessor_id": {
      "type": "string",
      "pattern": "^[a-z0-9]+(?:-[a-z0-9]+)*$"
    },
    "observed_at": {
      "type": "string",
      "pattern": "^\\d{4}-\\d{2}-\\d{2}T\\d{2}:\\d{2}:\\d{2}Z$"
    },
    "report_refs": {
      "type": "array",
      "items": {
        "type": "string",
        "pattern": "^sha256:[0-9a-f]{64}$"
      },
      "minItems": 1,
      "maxItems": 1000,
      "uniqueItems": true
    },
    "deployment_id": {
      "type": "string",
      "pattern": "^[a-z0-9]+(?:-[a-z0-9]+)*$"
    },
    "assessed_component_ids": {
      "type": "array",
      "items": {
        "type": "string",
        "pattern": "^[a-z0-9]+(?:-[a-z0-9]+)*$"
      },
      "minItems": 1,
      "maxItems": 1000,
      "uniqueItems": true
    },
    "components": {
      "type": "array",
      "items": {
        "type": "object",
        "additionalProperties": false,
        "required": [
          "component_id",
          "role",
          "service_keys",
          "metadata_fields",
          "application_plaintext_access",
          "application_key_access",
          "backup_recovery_key_access",
          "can_authorize_e2ee_devices",
          "logs_application_content",
          "metadata_at_rest_encrypted",
          "subprocessors_assessed"
        ],
        "properties": {
          "component_id": {
            "type": "string",
            "pattern": "^[a-z0-9]+(?:-[a-z0-9]+)*$"
          },
          "role": {
            "type": "string",
            "enum": [
              "relay",
              "queue",
              "object-store",
              "push-provider",
              "cdn",
              "backup-store",
              "kms",
              "diagnostics",
              "indexer"
            ]
          },
          "service_keys": {
            "type": "array",
            "items": {
              "type": "object",
              "additionalProperties": false,
              "required": [
                "key_id",
                "purpose",
                "shared_with_application_e2ee"
              ],
              "properties": {
                "key_id": {
                  "type": "string",
                  "pattern": "^[a-z0-9]+(?:-[a-z0-9]+)*$"
                },
                "purpose": {
                  "type": "string",
                  "enum": [
                    "tls-authentication",
                    "metadata-at-rest",
                    "abuse-control"
                  ]
                },
                "shared_with_application_e2ee": {
                  "type": "boolean"
                }
              }
            },
            "minItems": 0,
            "maxItems": 1000,
            "uniqueItems": true
          },
          "metadata_fields": {
            "type": "array",
            "items": {
              "type": "string",
              "enum": [
                "recipient-route",
                "ciphertext-size",
                "expiry",
                "delivery-state"
              ]
            },
            "minItems": 0,
            "maxItems": 1000,
            "uniqueItems": true
          },
          "application_plaintext_access": {
            "type": "boolean"
          },
          "application_key_access": {
            "type": "boolean"
          },
          "backup_recovery_key_access": {
            "type": "boolean"
          },
          "can_authorize_e2ee_devices": {
            "type": "boolean"
          },
          "logs_application_content": {
            "type": "boolean"
          },
          "metadata_at_rest_encrypted": {
            "type": "boolean"
          },
          "subprocessors_assessed": {
            "type": "boolean"
          }
        }
      },
      "minItems": 1,
      "maxItems": 1000,
      "uniqueItems": true
    },
    "objects": {
      "type": "array",
      "items": {
        "type": "object",
        "additionalProperties": false,
        "required": [
          "object_id",
          "object_locator",
          "component_id",
          "created_at",
          "expires_at",
          "deleted_at",
          "recipient_device_ids",
          "authorized_device_ids",
          "authenticated_envelope",
          "held_ciphertext_only",
          "derivatives_encrypted",
          "keys_in_locator",
          "plaintext_search_index"
        ],
        "properties": {
          "object_id": {
            "type": "string",
            "pattern": "^[a-z0-9]+(?:-[a-z0-9]+)*$"
          },
          "object_locator": {
            "type": "string",
            "pattern": "^[a-z0-9]+(?:-[a-z0-9]+)*$"
          },
          "component_id": {
            "type": "string",
            "pattern": "^[a-z0-9]+(?:-[a-z0-9]+)*$"
          },
          "created_at": {
            "type": "string",
            "pattern": "^\\d{4}-\\d{2}-\\d{2}T\\d{2}:\\d{2}:\\d{2}Z$"
          },
          "expires_at": {
            "type": "string",
            "pattern": "^\\d{4}-\\d{2}-\\d{2}T\\d{2}:\\d{2}:\\d{2}Z$"
          },
          "deleted_at": {
            "type": [
              "null",
              "string"
            ],
            "pattern": "^\\d{4}-\\d{2}-\\d{2}T\\d{2}:\\d{2}:\\d{2}Z$"
          },
          "recipient_device_ids": {
            "type": "array",
            "items": {
              "type": "string",
              "pattern": "^[a-z0-9]+(?:-[a-z0-9]+)*$"
            },
            "minItems": 1,
            "maxItems": 1000,
            "uniqueItems": true
          },
          "authorized_device_ids": {
            "type": "array",
            "items": {
              "type": "string",
              "pattern": "^[a-z0-9]+(?:-[a-z0-9]+)*$"
            },
            "minItems": 1,
            "maxItems": 1000,
            "uniqueItems": true
          },
          "authenticated_envelope": {
            "type": "boolean"
          },
          "held_ciphertext_only": {
            "type": "boolean"
          },
          "derivatives_encrypted": {
            "type": "boolean"
          },
          "keys_in_locator": {
            "type": "boolean"
          },
          "plaintext_search_index": {
            "type": "boolean"
          }
        }
      },
      "minItems": 1,
      "maxItems": 1000,
      "uniqueItems": true
    },
    "client_envelope_validation": {
      "type": "boolean"
    },
    "storage_credentials_separate_from_e2ee": {
      "type": "boolean"
    },
    "compromise_test_completed": {
      "type": "boolean"
    }
  }
}
